Investment in transport with private participation (current US$),IE.PPI.TRAN.CD,IE.PPI.TRAN.CD - Investment in transport with private participation (current US$)
Investment in water and sanitation with private participation (current US$),IE.PPI.WATR.CD,IE.PPI.WATR.CD - Investment in water and sanitation with private participation (current US$)
"Labor force participation rate for ages 15-24, female (%) (modeled ILO estimate)",SL.TLF.ACTI.1524.FE.ZS,"SL.TLF.ACTI.1524.FE.ZS - Labor force participation rate for ages 15-24, female (%) (modeled ILO estimate)"
"Labor force participation rate for ages 15-24, female (%) (national estimate)",SL.TLF.ACTI.1524.FE.NE.ZS,"SL.TLF.ACTI.1524.FE.NE.ZS - Labor force participation rate for ages 15-24, female (%) (national estimate)"
"Labor force participation rate for ages 15-24, male (%) (modeled ILO estimate)",SL.TLF.ACTI.1524.MA.ZS,"SL.TLF.ACTI.1524.MA.ZS - Labor force participation rate for ages 15-24, male (%) (modeled ILO estimate)"
"Labor force participation rate for ages 15-24, male (%) (national estimate)",SL.TLF.ACTI.1524.MA.NE.ZS,"SL.TLF.ACTI.1524.MA.NE.ZS - Labor force participation rate for ages 15-24, male (%) (national estimate)"
"Labor force participation rate for ages 15-24, total (%) (modeled ILO estimate)",SL.TLF.ACTI.1524.ZS,"SL.TLF.ACTI.1524.ZS - Labor force participation rate for ages 15-24, total (%) (modeled ILO estimate)"
"Labor force participation rate for ages 15-24, total (%) (national estimate)",SL.TLF.ACTI.1524.NE.ZS,"SL.TLF.ACTI.1524.NE.ZS - Labor force participation rate for ages 15-24, total (%) (national estimate)"
"Labor force participation rate, female (% of female population ages 15+) (modeled ILO estimate)",SL.TLF.CACT.FE.ZS,"SL.TLF.CACT.FE.ZS - Labor force participation rate, female (% of female population ages 15+) (modeled ILO estimate)"
"Labor force participation rate, female (% of female population ages 15+) (national estimate)",SL.TLF.CACT.FE.NE.ZS,"SL.TLF.CACT.FE.NE.ZS - Labor force participation rate, female (% of female population ages 15+) (national estimate)"
"Labor force participation rate, female (% of female population ages 15-64) (modeled ILO estimate)",SL.TLF.ACTI.FE.ZS,"SL.TLF.ACTI.FE.ZS - Labor force participation rate, female (% of female population ages 15-64) (modeled ILO estimate)"
"Labor force participation rate, male (% of male population ages 15+) (modeled ILO estimate)",SL.TLF.CACT.MA.ZS,"SL.TLF.CACT.MA.ZS - Labor force participation rate, male (% of male population ages 15+) (modeled ILO estimate)"
"Labor force participation rate, male (% of male population ages 15+) (national estimate)",SL.TLF.CACT.MA.NE.ZS,"SL.TLF.CACT.MA.NE.ZS - Labor force participation rate, male (% of male population ages 15+) (national estimate)"
"Labor force participation rate, male (% of male population ages 15-64) (modeled ILO estimate)",SL.TLF.ACTI.MA.ZS,"SL.TLF.ACTI.MA.ZS - Labor force participation rate, male (% of male population ages 15-64) (modeled ILO estimate)"
"Labor force participation rate, total (% of total population ages 15+) (modeled ILO estimate)",SL.TLF.CACT.ZS,"SL.TLF.CACT.ZS - Labor force participation rate, total (% of total population ages 15+) (modeled ILO estimate)"
"Labor force participation rate, total (% of total population ages 15+) (national estimate)",SL.TLF.CACT.NE.ZS,"SL.TLF.CACT.NE.ZS - Labor force participation rate, total (% of total population ages 15+) (national estimate)"
"Labor force participation rate, total (% of total population ages 15-64) (modeled ILO estimate)",SL.TLF.ACTI.ZS,"SL.TLF.ACTI.ZS - Labor force participation rate, total (% of total population ages 15-64) (modeled ILO estimate)"
Labor force with advanced education (% of total working-age population with advanced education),SL.TLF.ADVN.ZS,SL.TLF.ADVN.ZS - Labor force with advanced education (% of total working-age population with advanced education)
"Labor force with advanced education, female (% of female working-age population with advanced education)",SL.TLF.ADVN.FE.ZS,"SL.TLF.ADVN.FE.ZS - Labor force with advanced education, female (% of female working-age population with advanced education)"
"Labor force with advanced education, male (% of male working-age population with advanced education)",SL.TLF.ADVN.MA.ZS,"SL.TLF.ADVN.MA.ZS - Labor force with advanced education, male (% of male working-age population with advanced education)"
Labor force with basic education (% of total working-age population with basic education),SL.TLF.BASC.ZS,SL.TLF.BASC.ZS - Labor force with basic education (% of total working-age population with basic education)
"Labor force with basic education, female (% of female working-age population with basic education)",SL.TLF.BASC.FE.ZS,"SL.TLF.BASC.FE.ZS - Labor force with basic education, female (% of female working-age population with basic education)"
"Labor force with basic education, male (% of male working-age population with basic education)",SL.TLF.BASC.MA.ZS,"SL.TLF.BASC.MA.ZS - Labor force with basic education, male (% of male working-age population with basic education)"
Labor force with intermediate education (% of total working-age population with intermediate education),SL.TLF.INTM.ZS,SL.TLF.INTM.ZS - Labor force with intermediate education (% of total working-age population with intermediate education)
"Labor force with intermediate education, female (% of female working-age population with intermediate education)",SL.TLF.INTM.FE.ZS,"SL.TLF.INTM.FE.ZS - Labor force with intermediate education, female (% of female working-age population with intermediate education)"
"Labor force with intermediate education, male (% of male working-age population with intermediate education)",SL.TLF.INTM.MA.ZS,"SL.TLF.INTM.MA.ZS - Labor force with intermediate education, male (% of male working-age population with intermediate education)"
"Labor force, female (% of total labor force)",SL.TLF.TOTL.FE.ZS,"SL.TLF.TOTL.FE.ZS - Labor force, female (% of total labor force)"
"Labor force, total",SL.TLF.TOTL.IN,"SL.TLF.TOTL.IN - Labor force, total"
Labor tax and contributions (% of commercial profits),IC.TAX.LABR.CP.ZS,IC.TAX.LABR.CP.ZS - Labor tax and contributions (% of commercial profits)
Land area (sq. km),AG.LND.TOTL.K2,AG.LND.TOTL.K2 - Land area (sq. km)
Land area where elevation is below 5 meters (% of total land area),AG.LND.EL5M.ZS,AG.LND.EL5M.ZS - Land area where elevation is below 5 meters (% of total land area)
Land under cereal production (hectares),AG.LND.CREL.HA,AG.LND.CREL.HA - Land under cereal production (hectares)
"Lead time to export, median case (days)",LP.EXP.DURS.MD,"LP.EXP.DURS.MD - Lead time to export, median case (days)"
"Lead time to import, median case (days)",LP.IMP.DURS.MD,"LP.IMP.DURS.MD - Lead time to import, median case (days)"
Learning poverty: Share of Children at the End-of-Primary age below minimum reading proficiency adjusted by Out-of-School Children (%),SE.LPV.PRIM,SE.LPV.PRIM - Learning poverty: Share of Children at the End-of-Primary age below minimum reading proficiency adjusted by Out-of-School Children (%)
Learning poverty: Share of Female Children at the End-of-Primary age below minimum reading proficiency adjusted by Out-of-School Children (%),SE.LPV.PRIM.FE,SE.LPV.PRIM.FE - Learning poverty: Share of Female Children at the End-of-Primary age below minimum reading proficiency adjusted by Out-of-School Children (%)
Learning poverty: Share of Male Children at the End-of-Primary age below minimum reading proficiency adjusted by Out-of-School Children (%),SE.LPV.PRIM.MA,SE.LPV.PRIM.MA - Learning poverty: Share of Male Children at the End-of-Primary age below minimum reading proficiency adjusted by Out-of-School Children (%)
Lending interest rate (%),FR.INR.LEND,FR.INR.LEND - Lending interest rate (%)
Level of water stress: freshwater withdrawal as a proportion of available freshwater resources,ER.H2O.FWST.ZS,ER.H2O.FWST.ZS - Level of water stress: freshwater withdrawal as a proportion of available freshwater resources
"Life expectancy at birth, female (years)",SP.DYN.LE00.FE.IN,"SP.DYN.LE00.FE.IN - Life expectancy at birth, female (years)"
"Life expectancy at birth, male (years)",SP.DYN.LE00.MA.IN,"SP.DYN.LE00.MA.IN - Life expectancy at birth, male (years)"
"Life expectancy at birth, total (years)",SP.DYN.LE00.IN,"SP.DYN.LE00.IN - Life expectancy at birth, total (years)"
Lifetime risk of maternal death (%),SH.MMR.RISK.ZS,SH.MMR.RISK.ZS - Lifetime risk of maternal death (%)
Lifetime risk of maternal death (1 in: rate varies by country),SH.MMR.RISK,SH.MMR.RISK - Lifetime risk of maternal death (1 in: rate varies by country)
Liner shipping connectivity index (maximum value in 2004 = 100),IS.SHP.GCNW.XQ,IS.SHP.GCNW.XQ - Liner shipping connectivity index (maximum value in 2004 = 100)
"Listed domestic companies, total",CM.MKT.LDOM.NO,"CM.MKT.LDOM.NO - Listed domestic companies, total"
"Literacy rate, adult female (% of females ages 15 and above)",SE.ADT.LITR.FE.ZS,"SE.ADT.LITR.FE.ZS - Literacy rate, adult female (% of females ages 15 and above)"
"Literacy rate, adult male (% of males ages 15 and above)",SE.ADT.LITR.MA.ZS,"SE.ADT.LITR.MA.ZS - Literacy rate, adult male (% of males ages 15 and above)"
"Literacy rate, adult total (% of people ages 15 and above)",SE.ADT.LITR.ZS,"SE.ADT.LITR.ZS - Literacy rate, adult total (% of people ages 15 and above)"
"Literacy rate, youth (ages 15-24), gender parity index (GPI)",SE.ADT.1524.LT.FM.ZS,"SE.ADT.1524.LT.FM.ZS - Literacy rate, youth (ages 15-24), gender parity index (GPI)"
"Literacy rate, youth female (% of females ages 15-24)",SE.ADT.1524.LT.FE.ZS,"SE.ADT.1524.LT.FE.ZS - Literacy rate, youth female (% of females ages 15-24)"
"Literacy rate, youth male (% of males ages 15-24)",SE.ADT.1524.LT.MA.ZS,"SE.ADT.1524.LT.MA.ZS - Literacy rate, youth male (% of males ages 15-24)"
"Literacy rate, youth total (% of people ages 15-24)",SE.ADT.1524.LT.ZS,"SE.ADT.1524.LT.ZS - Literacy rate, youth total (% of people ages 15-24)"
Livestock production index (2014-2016 = 100),AG.PRD.LVSK.XD,AG.PRD.LVSK.XD - Livestock production index (2014-2016 = 100)
Logistics performance index: Ability to track and trace consignments (1=low to 5=high),LP.LPI.TRAC.XQ,LP.LPI.TRAC.XQ - Logistics performance index: Ability to track and trace consignments (1=low to 5=high)
Logistics performance index: Competence and quality of logistics services (1=low to 5=high),LP.LPI.LOGS.XQ,LP.LPI.LOGS.XQ - Logistics performance index: Competence and quality of logistics services (1=low to 5=high)
Logistics performance index: Ease of arranging competitively priced shipments (1=low to 5=high),LP.LPI.ITRN.XQ,LP.LPI.ITRN.XQ - Logistics performance index: Ease of arranging competitively priced shipments (1=low to 5=high)
Logistics performance index: Efficiency of customs clearance process (1=low to 5=high),LP.LPI.CUST.XQ,LP.LPI.CUST.XQ - Logistics performance index: Efficiency of customs clearance process (1=low to 5=high)
Logistics performance index: Frequency with which shipments reach consignee within scheduled or expected time (1=low to 5=high),LP.LPI.TIME.XQ,LP.LPI.TIME.XQ - Logistics performance index: Frequency with which shipments reach consignee within scheduled or expected time (1=low to 5=high)
Logistics performance index: Overall (1=low to 5=high),LP.LPI.OVRL.XQ,LP.LPI.OVRL.XQ - Logistics performance index: Overall (1=low to 5=high)
Logistics performance index: Quality of trade and transport-related infrastructure (1=low to 5=high),LP.LPI.INFR.XQ,LP.LPI.INFR.XQ - Logistics performance index: Quality of trade and transport-related infrastructure (1=low to 5=high)
Losses due to theft and vandalism (% of annual sales for affected firms),IC.FRM.CRIM.ZS,IC.FRM.CRIM.ZS - Losses due to theft and vandalism (% of annual sales for affected firms)
Low-birthweight babies (% of births),SH.STA.BRTW.ZS,SH.STA.BRTW.ZS - Low-birthweight babies (% of births)
"Lower secondary completion rate, female (% of relevant age group)",SE.SEC.CMPT.LO.FE.ZS,"SE.SEC.CMPT.LO.FE.ZS - Lower secondary completion rate, female (% of relevant age group)"
"Lower secondary completion rate, male (% of relevant age group)",SE.SEC.CMPT.LO.MA.ZS,"SE.SEC.CMPT.LO.MA.ZS - Lower secondary completion rate, male (% of relevant age group)"
"Lower secondary completion rate, total (% of relevant age group)",SE.SEC.CMPT.LO.ZS,"SE.SEC.CMPT.LO.ZS - Lower secondary completion rate, total (% of relevant age group)"
Lower secondary school starting age (years),SE.SEC.AGES,SE.SEC.AGES - Lower secondary school starting age (years)
Machinery and transport equipment (% of value added in manufacturing),NV.MNF.MTRN.ZS.UN,NV.MNF.MTRN.ZS.UN - Machinery and transport equipment (% of value added in manufacturing)
Male primary school age children out-of-school (%),SE.LPV.PRIM.SD.MA,SE.LPV.PRIM.SD.MA - Male primary school age children out-of-school (%)
Male pupils below minimum reading proficiency at end of primary (%). Low GAML threshold,SE.LPV.PRIM.LD.MA,SE.LPV.PRIM.LD.MA - Male pupils below minimum reading proficiency at end of primary (%). Low GAML threshold
"Mammal species, threatened",EN.MAM.THRD.NO,"EN.MAM.THRD.NO - Mammal species, threatened"
Manufactures exports (% of merchandise exports),TX.VAL.MANF.ZS.UN,TX.VAL.MANF.ZS.UN - Manufactures exports (% of merchandise exports)
Manufactures imports (% of merchandise imports),TM.VAL.MANF.ZS.UN,TM.VAL.MANF.ZS.UN - Manufactures imports (% of merchandise imports)
"Manufacturing, value added (% of GDP)",NV.IND.MANF.ZS,"NV.IND.MANF.ZS - Manufacturing, value added (% of GDP)"
"Manufacturing, value added (annual % growth)",NV.IND.MANF.KD.ZG,"NV.IND.MANF.KD.ZG - Manufacturing, value added (annual % growth)"
"Manufacturing, value added (constant 2015 US$)",NV.IND.MANF.KD,"NV.IND.MANF.KD - Manufacturing, value added (constant 2015 US$)"
"Manufacturing, value added (constant LCU)",NV.IND.MANF.KN,"NV.IND.MANF.KN - Manufacturing, value added (constant LCU)"
"Manufacturing, value added (current LCU)",NV.IND.MANF.CN,"NV.IND.MANF.CN - Manufacturing, value added (current LCU)"
"Manufacturing, value added (current US$)",NV.IND.MANF.CD,"NV.IND.MANF.CD - Manufacturing, value added (current US$)"
Marine protected areas (% of territorial waters),ER.MRN.PTMR.ZS,ER.MRN.PTMR.ZS - Marine protected areas (% of territorial waters)
Market capitalization of listed domestic companies (% of GDP),CM.MKT.LCAP.GD.ZS,CM.MKT.LCAP.GD.ZS - Market capitalization of listed domestic companies (% of GDP)
Market capitalization of listed domestic companies (current US$),CM.MKT.LCAP.CD,CM.MKT.LCAP.CD - Market capitalization of listed domestic companies (current US$)
"Maternal mortality ratio (modeled estimate, per 100,000 live births)",SH.STA.MMRT,"SH.STA.MMRT - Maternal mortality ratio (modeled estimate, per 100,000 live births)"
"Maternal mortality ratio (national estimate, per 100,000 live births)",SH.STA.MMRT.NE,"SH.STA.MMRT.NE - Maternal mortality ratio (national estimate, per 100,000 live births)"
Medium and high-tech exports (% manufactured exports),TX.MNF.TECH.ZS.UN,TX.MNF.TECH.ZS.UN - Medium and high-tech exports (% manufactured exports)
Medium and high-tech manufacturing value added (% manufacturing value added),NV.MNF.TECH.ZS.UN,NV.MNF.TECH.ZS.UN - Medium and high-tech manufacturing value added (% manufacturing value added)
Merchandise exports (current US$),TX.VAL.MRCH.CD.WT,TX.VAL.MRCH.CD.WT - Merchandise exports (current US$)
Merchandise exports by the reporting economy (current US$),TX.VAL.MRCH.WL.CD,TX.VAL.MRCH.WL.CD - Merchandise exports by the reporting economy (current US$)
"Merchandise exports by the reporting economy, residual (% of total merchandise exports)",TX.VAL.MRCH.RS.ZS,"TX.VAL.MRCH.RS.ZS - Merchandise exports by the reporting economy, residual (% of total merchandise exports)"
Merchandise exports to economies in the Arab World (% of total merchandise exports),TX.VAL.MRCH.AL.ZS,TX.VAL.MRCH.AL.ZS - Merchandise exports to economies in the Arab World (% of total merchandise exports)
Merchandise exports to high-income economies (% of total merchandise exports),TX.VAL.MRCH.HI.ZS,TX.VAL.MRCH.HI.ZS - Merchandise exports to high-income economies (% of total merchandise exports)
Merchandise exports to low- and middle-income economies in East Asia & Pacific (% of total merchandise exports),TX.VAL.MRCH.R1.ZS,TX.VAL.MRCH.R1.ZS - Merchandise exports to low- and middle-income economies in East Asia & Pacific (% of total merchandise exports)
Merchandise exports to low- and middle-income economies in Europe & Central Asia (% of total merchandise exports),TX.VAL.MRCH.R2.ZS,TX.VAL.MRCH.R2.ZS - Merchandise exports to low- and middle-income economies in Europe & Central Asia (% of total merchandise exports)
Merchandise exports to low- and middle-income economies in Latin America & the Caribbean (% of total merchandise exports),TX.VAL.MRCH.R3.ZS,TX.VAL.MRCH.R3.ZS - Merchandise exports to low- and middle-income economies in Latin America & the Caribbean (% of total merchandise exports)
Merchandise exports to low- and middle-income economies in Middle East & North Africa (% of total merchandise exports),TX.VAL.MRCH.R4.ZS,TX.VAL.MRCH.R4.ZS - Merchandise exports to low- and middle-income economies in Middle East & North Africa (% of total merchandise exports)
Merchandise exports to low- and middle-income economies in South Asia (% of total merchandise exports),TX.VAL.MRCH.R5.ZS,TX.VAL.MRCH.R5.ZS - Merchandise exports to low- and middle-income economies in South Asia (% of total merchandise exports)
Merchandise exports to low- and middle-income economies in Sub-Saharan Africa (% of total merchandise exports),TX.VAL.MRCH.R6.ZS,TX.VAL.MRCH.R6.ZS - Merchandise exports to low- and middle-income economies in Sub-Saharan Africa (% of total merchandise exports)
Merchandise exports to low- and middle-income economies outside region (% of total merchandise exports),TX.VAL.MRCH.OR.ZS,TX.VAL.MRCH.OR.ZS - Merchandise exports to low- and middle-income economies outside region (% of total merchandise exports)
Merchandise exports to low- and middle-income economies within region (% of total merchandise exports),TX.VAL.MRCH.WR.ZS,TX.VAL.MRCH.WR.ZS - Merchandise exports to low- and middle-income economies within region (% of total merchandise exports)
Merchandise imports (current US$),TM.VAL.MRCH.CD.WT,TM.VAL.MRCH.CD.WT - Merchandise imports (current US$)
Merchandise imports by the reporting economy (current US$),TM.VAL.MRCH.WL.CD,TM.VAL.MRCH.WL.CD - Merchandise imports by the reporting economy (current US$)
"Merchandise imports by the reporting economy, residual (% of total merchandise imports)",TM.VAL.MRCH.RS.ZS,"TM.VAL.MRCH.RS.ZS - Merchandise imports by the reporting economy, residual (% of total merchandise imports)"
Merchandise imports from economies in the Arab World (% of total merchandise imports),TM.VAL.MRCH.AL.ZS,TM.VAL.MRCH.AL.ZS - Merchandise imports from economies in the Arab World (% of total merchandise imports)
Merchandise imports from high-income economies (% of total merchandise imports),TM.VAL.MRCH.HI.ZS,TM.VAL.MRCH.HI.ZS - Merchandise imports from high-income economies (% of total merchandise imports)
Merchandise imports from low- and middle-income economies in East Asia & Pacific (% of total merchandise imports),TM.VAL.MRCH.R1.ZS,TM.VAL.MRCH.R1.ZS - Merchandise imports from low- and middle-income economies in East Asia & Pacific (% of total merchandise imports)
Merchandise imports from low- and middle-income economies in Europe & Central Asia (% of total merchandise imports),TM.VAL.MRCH.R2.ZS,TM.VAL.MRCH.R2.ZS - Merchandise imports from low- and middle-income economies in Europe & Central Asia (% of total merchandise imports)
Merchandise imports from low- and middle-income economies in Latin America & the Caribbean (% of total merchandise imports),TM.VAL.MRCH.R3.ZS,TM.VAL.MRCH.R3.ZS - Merchandise imports from low- and middle-income economies in Latin America & the Caribbean (% of total merchandise imports)
Merchandise imports from low- and middle-income economies in Middle East & North Africa (% of total merchandise imports),TM.VAL.MRCH.R4.ZS,TM.VAL.MRCH.R4.ZS - Merchandise imports from low- and middle-income economies in Middle East & North Africa (% of total merchandise imports)
Merchandise imports from low- and middle-income economies in South Asia (% of total merchandise imports),TM.VAL.MRCH.R5.ZS,TM.VAL.MRCH.R5.ZS - Merchandise imports from low- and middle-income economies in South Asia (% of total merchandise imports)
Merchandise imports from low- and middle-income economies in Sub-Saharan Africa (% of total merchandise imports),TM.VAL.MRCH.R6.ZS,TM.VAL.MRCH.R6.ZS - Merchandise imports from low- and middle-income economies in Sub-Saharan Africa (% of total merchandise imports)
Merchandise imports from low- and middle-income economies outside region (% of total merchandise imports),TM.VAL.MRCH.OR.ZS,TM.VAL.MRCH.OR.ZS - Merchandise imports from low- and middle-income economies outside region (% of total merchandise imports)
Merchandise imports from low- and middle-income economies within region (% of total merchandise imports),TM.VAL.MRCH.WR.ZS,TM.VAL.MRCH.WR.ZS - Merchandise imports from low- and middle-income economies within region (% of total merchandise imports)
Merchandise trade (% of GDP),TG.VAL.TOTL.GD.ZS,TG.VAL.TOTL.GD.ZS - Merchandise trade (% of GDP)
Methane (CH4) emissions (total) excluding LULUCF (% change from 1990),EN.GHG.CH4.ZG.AR5,EN.GHG.CH4.ZG.AR5 - Methane (CH4) emissions (total) excluding LULUCF (% change from 1990)
Methane (CH4) emissions (total) excluding LULUCF (Mt CO2e),EN.GHG.CH4.MT.CE.AR5,EN.GHG.CH4.MT.CE.AR5 - Methane (CH4) emissions (total) excluding LULUCF (Mt CO2e)
Methane (CH4) emissions from Agriculture (Mt CO2e),EN.GHG.CH4.AG.MT.CE.AR5,EN.GHG.CH4.AG.MT.CE.AR5 - Methane (CH4) emissions from Agriculture (Mt CO2e)
Methane (CH4) emissions from Building (Energy) (Mt CO2e),EN.GHG.CH4.BU.MT.CE.AR5,EN.GHG.CH4.BU.MT.CE.AR5 - Methane (CH4) emissions from Building (Energy) (Mt CO2e)
Methane (CH4) emissions from Fugitive Emissions (Energy) (Mt CO2e),EN.GHG.CH4.FE.MT.CE.AR5,EN.GHG.CH4.FE.MT.CE.AR5 - Methane (CH4) emissions from Fugitive Emissions (Energy) (Mt CO2e)
Methane (CH4) emissions from Industrial Combustion (Energy) (Mt CO2e),EN.GHG.CH4.IC.MT.CE.AR5,EN.GHG.CH4.IC.MT.CE.AR5 - Methane (CH4) emissions from Industrial Combustion (Energy) (Mt CO2e)
Methane (CH4) emissions from Industrial Processes (Mt CO2e),EN.GHG.CH4.IP.MT.CE.AR5,EN.GHG.CH4.IP.MT.CE.AR5 - Methane (CH4) emissions from Industrial Processes (Mt CO2e)
Methane (CH4) emissions from Power Industry (Energy) (Mt CO2e),EN.GHG.CH4.PI.MT.CE.AR5,EN.GHG.CH4.PI.MT.CE.AR5 - Methane (CH4) emissions from Power Industry (Energy) (Mt CO2e)
Methane (CH4) emissions from Transport (Energy) (Mt CO2e),EN.GHG.CH4.TR.MT.CE.AR5,EN.GHG.CH4.TR.MT.CE.AR5 - Methane (CH4) emissions from Transport (Energy) (Mt CO2e)
Methane (CH4) emissions from Waste (Mt CO2e),EN.GHG.CH4.WA.MT.CE.AR5,EN.GHG.CH4.WA.MT.CE.AR5 - Methane (CH4) emissions from Waste (Mt CO2e)
Military expenditure (% of GDP),MS.MIL.XPND.GD.ZS,MS.MIL.XPND.GD.ZS - Military expenditure (% of GDP)
Military expenditure (% of general government expenditure),MS.MIL.XPND.ZS,MS.MIL.XPND.ZS - Military expenditure (% of general government expenditure)
Military expenditure (current LCU),MS.MIL.XPND.CN,MS.MIL.XPND.CN - Military expenditure (current LCU)
Military expenditure (current USD),MS.MIL.XPND.CD,MS.MIL.XPND.CD - Military expenditure (current USD)
Mineral rents (% of GDP),NY.GDP.MINR.RT.ZS,NY.GDP.MINR.RT.ZS - Mineral rents (% of GDP)
Mobile cellular subscriptions,IT.CEL.SETS,IT.CEL.SETS - Mobile cellular subscriptions
Mobile cellular subscriptions (per 100 people),IT.CEL.SETS.P2,IT.CEL.SETS.P2 - Mobile cellular subscriptions (per 100 people)
Monetary Sector credit to private sector (% GDP),FM.AST.PRVT.GD.ZS,FM.AST.PRVT.GD.ZS - Monetary Sector credit to private sector (% GDP)
"Mortality caused by road traffic injury (per 100,000 population)",SH.STA.TRAF.P5,"SH.STA.TRAF.P5 - Mortality caused by road traffic injury (per 100,000 population)"
"Mortality from CVD, cancer, diabetes or CRD between exact ages 30 and 70 (%)",SH.DYN.NCOM.ZS,"SH.DYN.NCOM.ZS - Mortality from CVD, cancer, diabetes or CRD between exact ages 30 and 70 (%)"
"Mortality from CVD, cancer, diabetes or CRD between exact ages 30 and 70, female (%)",SH.DYN.NCOM.FE.ZS,"SH.DYN.NCOM.FE.ZS - Mortality from CVD, cancer, diabetes or CRD between exact ages 30 and 70, female (%)"
"Mortality from CVD, cancer, diabetes or CRD between exact ages 30 and 70, male (%)",SH.DYN.NCOM.MA.ZS,"SH.DYN.NCOM.MA.ZS - Mortality from CVD, cancer, diabetes or CRD between exact ages 30 and 70, male (%)"
"Mortality rate attributed to household and ambient air pollution, age-standardized (per 100,000 population)",SH.STA.AIRP.P5,"SH.STA.AIRP.P5 - Mortality rate attributed to household and ambient air pollution, age-standardized (per 100,000 population)"
"Mortality rate attributed to household and ambient air pollution, age-standardized, female (per 100,000 female population)",SH.STA.AIRP.FE.P5,"SH.STA.AIRP.FE.P5 - Mortality rate attributed to household and ambient air pollution, age-standardized, female (per 100,000 female population)"
"Mortality rate attributed to household and ambient air pollution, age-standardized, male (per 100,000 male population)",SH.STA.AIRP.MA.P5,"SH.STA.AIRP.MA.P5 - Mortality rate attributed to household and ambient air pollution, age-standardized, male (per 100,000 male population)"
"Mortality rate attributed to unintentional poisoning (per 100,000 population)",SH.STA.POIS.P5,"SH.STA.POIS.P5 - Mortality rate attributed to unintentional poisoning (per 100,000 population)"
"Mortality rate attributed to unintentional poisoning, female (per 100,000 female population)",SH.STA.POIS.P5.FE,"SH.STA.POIS.P5.FE - Mortality rate attributed to unintentional poisoning, female (per 100,000 female population)"
